{
  "$schema": "https://json-schema.org/draft/2020-12/schema",
  "$id": "https://hst314.github.io/agentic-design-harness/contracts/v1/token-usage-event.schema.json",
  "title": "TokenUsageEvent",
  "type": "object",
  "additionalProperties": false,
  "required": [
    "schema_version",
    "event_id",
    "task_id",
    "instance_id",
    "agent_type",
    "request_id",
    "model",
    "credential_pair_ref",
    "input_tokens",
    "output_tokens",
    "cached_input_tokens",
    "reasoning_tokens",
    "total_tokens",
    "occurred_at"
  ],
  "properties": {
    "schema_version": {
      "$ref": "common.schema.json#/$defs/schemaVersion"
    },
    "event_id": {
      "$ref": "common.schema.json#/$defs/identifier"
    },
    "task_id": {
      "$ref": "common.schema.json#/$defs/identifier"
    },
    "instance_id": {
      "$ref": "common.schema.json#/$defs/identifier"
    },
    "agent_type": {
      "type": "string",
      "enum": ["image", "ppt", "master"]
    },
    "request_id": {
      "type": "string",
      "minLength": 1,
      "maxLength": 256
    },
    "model": {
      "type": "string",
      "minLength": 1,
      "maxLength": 256
    },
    "credential_pair_ref": {
      "oneOf": [
        {
          "$ref": "common.schema.json#/$defs/identifier"
        },
        {
          "type": "null"
        }
      ]
    },
    "input_tokens": {
      "type": "integer",
      "minimum": 0
    },
    "output_tokens": {
      "type": "integer",
      "minimum": 0
    },
    "cached_input_tokens": {
      "type": "integer",
      "minimum": 0
    },
    "reasoning_tokens": {
      "type": "integer",
      "minimum": 0
    },
    "total_tokens": {
      "type": "integer",
      "minimum": 0
    },
    "cost_micros": {
      "type": "integer",
      "minimum": 0
    },
    "price_catalog_revision": {
      "$ref": "common.schema.json#/$defs/identifier"
    },
    "occurred_at": {
      "$ref": "common.schema.json#/$defs/timestamp"
    }
  },
  "allOf": [
    {
      "if": {
        "required": ["cost_micros"]
      },
      "then": {
        "required": ["price_catalog_revision"]
      }
    }
  ]
}
